platform,video_id,video_url,video_title,video_core_content,video_target_sentiment,comment,commonsense,video_highlight
tiktok,7628876598191623432,https://www.tiktok.com/@bbs.house/video/7628876598191623432?is_from_webapp=1,Là sao nữaaa. ...,"Video sử dụng các meme mèo được cắt ghép trên nền bối cảnh ban công để mô tả những trạng thái cảm xúc thay đổi của một cô gái trong mối quan hệ lâu dài. Một nhân vật mèo đại diện cho “tôi” đứng khá tĩnh, trong khi nhân vật mèo còn lại đại diện cho “ẻm” thay đổi liên tục qua nhiều biểu cảm và hành động. Text overlay mở đầu bằng câu “Pov: Quen nhau đủ lâu để thấy đủ nhân cách của em”, sau đó là các câu thoại như “A có iu pe hăm?”, “Đêm nay anh là của tôiiii”, “Hình như anh hết thương em rùi!” và “Biến đi thằng choá”. Video không có người thật xuất hiện, toàn bộ diễn biến dựa trên hình mèo, text và hiệu ứng âm thanh. Âm thanh thay đổi theo từng phân cảnh, gồm tiếng cười, tiếng khóc, âm thanh trẻ con và các hiệu ứng hành động ở đoạn cuối.",positive,người yêu thấy tôi thấy,'Người yêu thấy tôi thấy' có thể là cách nói lóng để chỉ việc người yêu nhận thức được sự thay đổi hoặc cảm xúc của bản thân trong mối quan hệ.,Meme mèo trên nền ban công; nhân vật “tôi” đứng yên còn nhân vật “ẻm” thay đổi liên tục; text overlay dùng teencode và câu thoại tình cảm; hiệu ứng âm thanh chuyển nhanh theo từng trạng thái.
youtube,HyDxRTBnwNM,https://www.youtube.com/watch?v=HyDxRTBnwNM,Huyền Thoại Đa Tình Páp-Lô Pi-Cát-Xô,"Video hoạt hình vẽ tay mang phong cách hài hước và châm biếm, kể về cuộc đời, sự nghiệp nghệ thuật vĩ đại đan xen với cuộc sống tình cảm vô cùng phức tạp, đào hoa và đầy scandal của danh họa người Tây Ban Nha Pablo Picasso. Giới thiệu xuất thân, thời thơ ấu và tài năng hội họa thiên bẩm bộc lộ từ rất sớm của Picasso, tạo tiền đề cho hành trình trở thành danh họa thế giới. Quá trình sáng tạo nghệ thuật qua các thời kỳ mang tính bước ngoặt lịch sử: Thời kỳ Xanh lam (Blue Period), Thời kỳ Hoa hồng (Rose Period) và đỉnh cao là việc đồng sáng lập trường phái Lập thể (Cubism). Đi sâu vào góc khuất đời tư, thói trăng hoa 'thay người yêu như thay áo', các mối quan hệ tình cảm phức tạp và những vụ bê bối 'cắm sừng' chấn động của ông. Tóm tắt di sản nghệ thuật khổng lồ nhưng đầy tranh cãi của Picasso, cùng góc nhìn mỉa mai của hậu thế về sự tương phản lớn giữa tài năng kiệt xuất và nhân cách đời tư.",neutral,cha của picasso mang thầy của davinci tự nhục xong không thèm dẽ nữa luôn :crying_face:,"Cha của Picasso là José Ruiz y Blasco, một họa sĩ và giáo viên mỹ thuật. Leonardo da Vinci (1452–1519) là họa sĩ, nhà phát minh người Ý, sống trước Picasso hơn 300 năm. Trong lịch sử nghệ thuật, không có ghi chép về mối quan hệ trực tiếp giữa hai gia đình này.","Giải thích về trường phái lập thể, các giai đoạn nghệ thuật (Xanh lam, Hoa hồng) và thói đa tình, ""cắm sừng"" của Picasso."
youtube,HyDxRTBnwNM,https://www.youtube.com/watch?v=HyDxRTBnwNM,Huyền Thoại Đa Tình Páp-Lô Pi-Cát-Xô,"Video hoạt hình vẽ tay mang phong cách hài hước và châm biếm, kể về cuộc đời, sự nghiệp nghệ thuật vĩ đại đan xen với cuộc sống tình cảm vô cùng phức tạp, đào hoa và đầy scandal của danh họa người Tây Ban Nha Pablo Picasso. Giới thiệu xuất thân, thời thơ ấu và tài năng hội họa thiên bẩm bộc lộ từ rất sớm của Picasso, tạo tiền đề cho hành trình trở thành danh họa thế giới. Quá trình sáng tạo nghệ thuật qua các thời kỳ mang tính bước ngoặt lịch sử: Thời kỳ Xanh lam (Blue Period), Thời kỳ Hoa hồng (Rose Period) và đỉnh cao là việc đồng sáng lập trường phái Lập thể (Cubism). Đi sâu vào góc khuất đời tư, thói trăng hoa 'thay người yêu như thay áo', các mối quan hệ tình cảm phức tạp và những vụ bê bối 'cắm sừng' chấn động của ông. Tóm tắt di sản nghệ thuật khổng lồ nhưng đầy tranh cãi của Picasso, cùng góc nhìn mỉa mai của hậu thế về sự tương phản lớn giữa tài năng kiệt xuất và nhân cách đời tư.",neutral,máy dập paris,"'Máy dập Paris' là cách nói phóng đại về việc có nhiều mối quan hệ tình cảm ở Paris. Picasso sống phần lớn cuộc đời tại Pháp và có nhiều người tình là nghệ sĩ, người mẫu sống tại Paris.","Giải thích về trường phái lập thể, các giai đoạn nghệ thuật (Xanh lam, Hoa hồng) và thói đa tình, ""cắm sừng"" của Picasso."
tiktok,7628876598191623432,https://www.tiktok.com/@bbs.house/video/7628876598191623432?is_from_webapp=1,Là sao nữaaa. ...,"Video sử dụng các meme mèo được cắt ghép trên nền bối cảnh ban công để mô tả những trạng thái cảm xúc thay đổi của một cô gái trong mối quan hệ lâu dài. Một nhân vật mèo đại diện cho “tôi” đứng khá tĩnh, trong khi nhân vật mèo còn lại đại diện cho “ẻm” thay đổi liên tục qua nhiều biểu cảm và hành động. Text overlay mở đầu bằng câu “Pov: Quen nhau đủ lâu để thấy đủ nhân cách của em”, sau đó là các câu thoại như “A có iu pe hăm?”, “Đêm nay anh là của tôiiii”, “Hình như anh hết thương em rùi!” và “Biến đi thằng choá”. Video không có người thật xuất hiện, toàn bộ diễn biến dựa trên hình mèo, text và hiệu ứng âm thanh. Âm thanh thay đổi theo từng phân cảnh, gồm tiếng cười, tiếng khóc, âm thanh trẻ con và các hiệu ứng hành động ở đoạn cuối.",positive,haha tao hơn cả thời tiết :face_with_tears_of_joy:,"Biểu tượng ':face_with_tears_of_joy:' là emoji thường dùng để thể hiện sự cười lớn đến chảy nước mắt. Câu 'hơn cả thời tiết' chỉ sự thay đổi tâm trạng thất thường, nhanh chóng và khó đoán hơn cả sự biến đổi của thời tiết.",Meme mèo trên nền ban công; nhân vật “tôi” đứng yên còn nhân vật “ẻm” thay đổi liên tục; text overlay dùng teencode và câu thoại tình cảm; hiệu ứng âm thanh chuyển nhanh theo từng trạng thái.
youtube,foeGbXU6pGI,https://www.youtube.com/watch?v=foeGbXU6pGI,Mạng Xã Hội không còn vui nữa,"Góc nhìn chiêm nghiệm sâu sắc và thẳng thắn của vlogger đời đầu JVevermind về thực trạng đen tối, sự độc hại của mạng xã hội hiện đại, nơi con người bị thao túng bởi thế giới ảo, drama dàn dựng và các hệ thống điều hướng dư luận. Đặt vấn đề về sự thay đổi tiêu cực của mạng xã hội: từ một không gian kết nối bạn bè thuần túy trở thành nơi sản sinh văn hóa 'phông bạt', sống ảo và cuồng si danh vọng giả tạo. Chỉ trích trực diện các vụ tạo scandal, dàn dựng drama tinh vi của những người nổi tiếng (như Phạm Thoại, Thủy Tiên) nhằm thâu tóm sự chú ý của đám đông để trục lợi truyền thông. Phân tích cơ chế kỹ thuật đứng sau hậu trường mạng xã hội, giải thích cách các hệ thống bot AI, tài khoản ảo (clone) và đội ngũ seeding được dùng để kích động tranh cãi, định hướng dư luận và thao túng tâm lý người dùng. Đưa ra lời khuyên mang tính triết lý về cách bảo vệ sức khỏe tinh thần, học cách 'ngừng quan tâm' trước những thị phi vô bổ để tìm lại giá trị sống đích thực ngoài đời thực.",negative,em 2k chơi mxh từ hồi học lớp 6 hồi cấp 2 mê đắm cảm giác muốn khám phá thế giới xung quanh tất cả mọi thứ đều mới và rộng lớn nhưng càng lúc càng thấy nó nhàm chán apps này nọ chỉ để liên lạc bây giờ thì bỏ luôn luôn rồi chỉ chừa youtube để xem video bật làm nền thôi thật sự mở tiktok facebook lên tất cả những gì đập vào mắt là drama phốt phiếc độc hại kinh khủng mà trên đó chửi nhau rất là ghê độc mồm thì thôi rồi mặc kệ bên phía màn hình bên kia có là con người và có thể bị tổn thương hay không,"'2k' là cách gọi thế hệ sinh từ năm 2000 trở đi. 'Phốt phiếc' là cách viết sai chính tả của từ 'phốt phét', tiếng lóng chỉ những vụ scandal hoặc thông tin gây sốc được lan truyền trên mạng xã hội. MXH là viết tắt của 'mạng xã hội'.","Chỉ trích các vụ drama của Phạm Thoại, Thủy Tiên; giải thích cách bot AI được dùng để kích động tranh luận và định hướng dư luận."
tiktok,7622268970770500885,https://www.tiktok.com/@bhmedialive/video/7622268970770500885?is_from_webapp=1,"Kết nhất cái câu ""Ú òa"" ...","Video thuộc dạng talking head kết hợp reaction, trong đó người dẫn tóm tắt một drama mạng xã hội liên quan đến TikToker Lê Xuân Lộc, còn được gọi là San hoặc Thục San, thuộc nhóm Gia đình Nala. Nội dung video trình bày các mốc sự kiện, phát ngôn và hình ảnh tư liệu liên quan đến nhân vật chính, đồng thời sử dụng nhiều ảnh chụp màn hình bình luận, chứng chỉ, ảnh chế và hiệu ứng chia đôi màn hình. Người dẫn xuất hiện trong phòng làm việc, liên tục thay đổi biểu cảm, chỉ tay vào các tư liệu và phản ứng theo từng tình tiết. Text overlay dùng chữ in hoa, màu đỏ hoặc vàng để nhấn mạnh các cụm từ như “HÓNG DRAMA LÀ PHỤ, XEM BIỂU CẢM YOBAE LÀ CHÍNH”, “UÁ OÀ”, “BỤM” và “Hãy là chính mình hơn”. Âm thanh gồm lời dẫn tiếng Việt, nhạc nền nhanh và nhiều hiệu ứng meme nhằm tạo cảm giác như một bản tin giải trí trên mạng xã hội.",negative,loạn luân lâu rồi mà,"'Loạn luân' là thuật ngữ chỉ quan hệ tình cảm hoặc hôn nhân giữa những người có quan hệ máu mủ gần gũi (như anh em, cha con, chú bác). Trong các video phản ánh drama mạng xã hội, thuật ngữ này thường được sử dụng để chỉ các mối quan hệ phức tạp hoặc gây tranh cãi trong nhóm Gia đình Nala.","Dạng talking head kết hợp reaction; sử dụng split-screen, ảnh chụp bình luận, chứng chỉ và ảnh chế; người dẫn phản ứng liên tục theo diễn biến drama; text overlay in hoa và hiệu ứng meme xuất hiện dày đặc."
youtube,5Augh75jX6g,https://www.youtube.com/watch?v=5Augh75jX6g,HIGHLIGHTS: ARSENAL - BOURNEMOUTH,"Diễn biến toàn bộ trận đấu bóng đá kịch tính giữa Arsenal và Bournemouth. Arsenal (đội cửa trên) được kỳ vọng sẽ giành chiến thắng dễ dàng nhưng đã vấp phải sự kháng cự mãnh liệt và suýt bị cầm hòa hoặc thua, gây tâm lý căng thẳng tột độ cho người hâm mộ trước khi có màn lội ngược dòng may mắn. Arsenal kiểm soát hoàn toàn thế trận trong hiệp 1, dồn ép đối thủ và nhanh chóng có bàn thắng vươn lên dẫn trước nhờ sự áp đảo của hàng công. Bournemouth bất ngờ vùng lên mạnh mẽ vào đầu hiệp 2, khai thác các lỗ hổng phòng ngự bất cẩn của Arsenal để ghi bàn gỡ hòa khiến thế trận đảo chiều. Trận đấu được đẩy lên đỉnh điểm với một pha thổi penalty đầy tranh cãi từ trọng tài, tạo ra làn sóng phản đối dữ dội từ ban huấn luyện và cầu thủ Arsenal. Những phút bù giờ cuối cùng đầy nghẹt thở, Arsenal ghi được bàn thắng quý như vàng để ấn định chiến thắng sát nút đầy chật vật, giải tỏa áp lực nhưng để lại nhiều hoài nghi về phong độ phòng ngự.",negative,vừa lòng tôi lắm phú phải ngao thế này đua vô địch mới hấp dẫn tầm này đá kiếm tiền chứ quan trọng gì vô địch phú tạo ra 1 giải kịch tính thu hút người xem kiếm nhiều tiền mùa hè mua sắm rồi sang năm ta làm lại nhé :face_with_tears_of_joy: :face_with_tears_of_joy: :face_with_tears_of_joy: :face_with_tears_of_joy:,"'Phú' trong bình luận này chỉ ông Nguyễn Đức Phú, Chủ tịch Tập đoàn Sovico và Phó Chủ tịch HĐQT CLB Hà Nội FC, một nhân vật có ảnh hưởng trong bóng đá Việt Nam. Giải đấu bóng đá chuyên nghiệp thường được tổ chức để thu hút khán giả và tạo doanh thu từ bản quyền truyền hình, quảng cáo.","Những sai lầm phòng ngự của Arsenal, pha penalty gây tranh cãi và cú lội ngược dòng đầy may mắn/khó khăn của đội chủ nhà."
youtube,yM8XxAwUM_M,https://www.youtube.com/watch?v=yM8XxAwUM_M,GIẤY GHI CHÚ TÂM NGUYỆN,"Màn trình diễn ca khúc 'Giấy ghi chú tâm nguyện' ngọt ngào và trẻ trung của nhóm nghệ sĩ Lý Tiểu Nhiễm, Đường Nghệ Hân và Vương Mông tại vòng Công diễn 1 của chương trình thực tế 'Chị Đẹp Đạp Gió 2026'. Giới thiệu các thành viên trong đội hình (Lý Tiểu Nhiễm, Đường Nghệ Hân, Vương Mông), ý tưởng dàn dựng sân khấu lấy cảm hứng thanh xuân và quá trình luyện tập vất vả trước giờ G. Mở đầu tiết mục với giai điệu nhẹ nhàng, các nghệ sĩ xuất hiện rạng rỡ trong trang phục dễ thương, mang lại không khí trong trẻo và hoài niệm cho khán giả. Đoạn cao trào của ca khúc phô diễn sự kết hợp giọng hát hòa quyện, vũ đạo đồng đều và các khoảnh khắc tương tác ngọt ngào giữa các tỷ tỷ trên sân khấu. Phần kết thúc tiết mục trong tiếng reo hò cổ vũ của khán giả tại trường quay, nhận xét từ ban giám khảo và màn reaction đầy hào hứng của các nghệ sĩ khác từ phòng chờ.",positive,nghe kĩ thì beat hay vãi lồn mà,'Beat hay vãi lồn' là cách nói lóng mạng có nghĩa là 'nhạc điệu (beat) rất hay và gây ấn tượng'. Ca khúc 'Giấy ghi chú tâm nguyện' có phần nhạc nền được thiết kế để phù hợp với giai điệu nhẹ nhàng và mang tính hoài niệm.,"Sự kết hợp giữa các nghệ sĩ Lý Tiểu Nhiễm, Đường Nghệ Hân; phong cách biểu diễn trẻ trung, mang tính giải trí thuần túy."
youtube,HyDxRTBnwNM,https://www.youtube.com/watch?v=HyDxRTBnwNM,Huyền Thoại Đa Tình Páp-Lô Pi-Cát-Xô,"Video hoạt hình vẽ tay mang phong cách hài hước và châm biếm, kể về cuộc đời, sự nghiệp nghệ thuật vĩ đại đan xen với cuộc sống tình cảm vô cùng phức tạp, đào hoa và đầy scandal của danh họa người Tây Ban Nha Pablo Picasso. Giới thiệu xuất thân, thời thơ ấu và tài năng hội họa thiên bẩm bộc lộ từ rất sớm của Picasso, tạo tiền đề cho hành trình trở thành danh họa thế giới. Quá trình sáng tạo nghệ thuật qua các thời kỳ mang tính bước ngoặt lịch sử: Thời kỳ Xanh lam (Blue Period), Thời kỳ Hoa hồng (Rose Period) và đỉnh cao là việc đồng sáng lập trường phái Lập thể (Cubism). Đi sâu vào góc khuất đời tư, thói trăng hoa 'thay người yêu như thay áo', các mối quan hệ tình cảm phức tạp và những vụ bê bối 'cắm sừng' chấn động của ông. Tóm tắt di sản nghệ thuật khổng lồ nhưng đầy tranh cãi của Picasso, cùng góc nhìn mỉa mai của hậu thế về sự tương phản lớn giữa tài năng kiệt xuất và nhân cách đời tư.",neutral,kĩ năng tán gái quá khét,"'Kĩ năng tán gái' là tiếng lóng chỉ khả năng thu hút và thuyết phục phụ nữ trong các mối quan hệ tình cảm. Pablo Picasso được ghi nhận có nhiều mối quan hệ tình ái với nhiều phụ nữ trong suốt cuộc đời, bao gồm cả các nghệ sĩ, người mẫu và nhà văn.","Giải thích về trường phái lập thể, các giai đoạn nghệ thuật (Xanh lam, Hoa hồng) và thói đa tình, ""cắm sừng"" của Picasso."
tiktok,7628064166992973077,https://www.tiktok.com/@saigondailytrending/video/7628064166992973077?is_from_webapp=1,Con có ăn được thịt gà không?,"Video là bản cắt ghép từ một phóng sự lớp học tiểu học trong giờ ăn bán trú. Trong đoạn đầu, cô giáo nói rằng bé Phương Anh không ăn được thịt gà nên gọi bé lên chia canh cho các bạn. Sau đó, ở phần phỏng vấn, phóng viên hỏi bé có ăn được thịt gà không và bé trả lời là có. Video dùng các đoạn zoom cận cảnh vào biểu cảm của bé, chuyển sang tông đen trắng ở cuối và thêm nhạc nền kiểu điều tra để tăng cảm giác kịch tính. Text overlay gồm các câu như “Mong VTV theo dõi năm nay bạn Phương Anh có được lên lớp không?”, “Ủa?” và “Có ạ”. Nội dung tập trung vào sự khác biệt giữa lời cô giáo nói và câu trả lời trực tiếp của học sinh trong phóng sự.",neutral,bé này giống bạn nào đóng phim nè tôi nhìn quen lắm luôn luôn phim hồi xưa á,"'Bé này giống bạn nào đóng phim nè' là nhận xét so sánh ngoại hình hoặc biểu cảm của học sinh với diễn viên trẻ trong phim truyền hình hoặc điện ảnh Việt Nam, thường xuất hiện trong các bộ phim giáo dục hoặc phim truyền hình cổ điển.",Bối cảnh lớp học giờ ăn bán trú; cô giáo gọi bé Phương Anh đi chia canh; phóng viên phỏng vấn bé về việc ăn thịt gà; text overlay nhấn mạnh câu “Ủa?” và “Có ạ”; cuối video có nhạc nền kịch tính.
tiktok,7628192889352293653,https://www.tiktok.com/@beatnow275/video/7628192889352293653?is_from_webapp=1,Khổ chú,"Video kể lại câu chuyện về quán lẩu gà Mạc Thị ở Phật Sơn, Quảng Đông, Trung Quốc bỗng trở nên nổi tiếng và thu hút rất đông khách. Ông chủ quán nhiều lần khuyên khách đừng đến vì quán quá đông, nhưng lượng khách vẫn tăng khiến cả gia đình phải tham gia hỗ trợ phục vụ. Video cho thấy cảnh khách xếp hàng, bãi xe đông, con cái của chủ quán chặt gà, ghi đơn và chính quyền địa phương hỗ trợ cải thiện đường sá để đón khách du lịch. Giọng đọc tiếng Việt kể lại câu chuyện với nhịp nhanh, nhấn mạnh việc một quán ăn bình dân bỗng trở thành điểm đến nổi bật. Text overlay dùng chữ in hoa để nêu các chi tiết như “không ngon đâu đừng đến” và “con trai lái Land Rover vẫn phải về chặt gà”.",neutral,lãnh đạo bên họ tuyệt vời thật sự :hundred_points: :red_heart: :red_heart:,"'Lãnh đạo bên họ' trong ngữ cảnh này đề cập đến chính quyền địa phương Quảng Đông, Trung Quốc, đã hỗ trợ cải thiện hạ tầng (đường sá) để đón du khách đến quán lẩu Mạc Thị. :hundred_points: và :red_heart: là biểu tượng cảm xúc trên mạng xã hội chỉ sự tán thành hoặc khen ngợi.",Quán ăn bình dân ở Quảng Đông đông khách bất ngờ; ông chủ khuyên khách không đến nhưng quán vẫn quá tải; gia đình chủ quán tham gia phục vụ; chính quyền hỗ trợ làm đường và điều phối du lịch địa phương.
tiktok,7628192889352293653,https://www.tiktok.com/@beatnow275/video/7628192889352293653?is_from_webapp=1,Khổ chú,"Video kể lại câu chuyện về quán lẩu gà Mạc Thị ở Phật Sơn, Quảng Đông, Trung Quốc bỗng trở nên nổi tiếng và thu hút rất đông khách. Ông chủ quán nhiều lần khuyên khách đừng đến vì quán quá đông, nhưng lượng khách vẫn tăng khiến cả gia đình phải tham gia hỗ trợ phục vụ. Video cho thấy cảnh khách xếp hàng, bãi xe đông, con cái của chủ quán chặt gà, ghi đơn và chính quyền địa phương hỗ trợ cải thiện đường sá để đón khách du lịch. Giọng đọc tiếng Việt kể lại câu chuyện với nhịp nhanh, nhấn mạnh việc một quán ăn bình dân bỗng trở thành điểm đến nổi bật. Text overlay dùng chữ in hoa để nêu các chi tiết như “không ngon đâu đừng đến” và “con trai lái Land Rover vẫn phải về chặt gà”.",neutral,chú nhả vía đông khách cho cháu đi ạ :face_with_tears_of_joy:,"'Nhả vía' là từ lóng mạng chỉ việc nhường chỗ, cơ hội hoặc quyền lợi cho người khác. Trong ngữ cảnh này, câu nói ám chỉ chủ quán Mạc Thị phải nhường chỗ cho khách hàng đông đúc đến mức gia đình phải tham gia phục vụ.",Quán ăn bình dân ở Quảng Đông đông khách bất ngờ; ông chủ khuyên khách không đến nhưng quán vẫn quá tải; gia đình chủ quán tham gia phục vụ; chính quyền hỗ trợ làm đường và điều phối du lịch địa phương.
tiktok,7619505128890010901,https://www.tiktok.com/@vsface/video/7619505128890010901?is_from_webapp=1,Ai ép 2 đứa ?? 🙂,"Video là một đoạn cắt từ chương trình thực tế, ghi lại cảnh hai người mẫu Hương Ly và Cao Ngân thực hiện phần quay quảng cáo trong bối cảnh studio phông trắng. Hai nhân vật đứng cạnh nhau, cố gắng đọc lời giới thiệu cho thương hiệu thời trang nhưng nhiều lần nói vấp, dùng sai ý và có cử chỉ khá gượng gạo. Máy quay thường zoom cận vào khuôn mặt lúng túng của hai người mẫu và phản ứng quan sát của giám khảo. Trên màn hình có dòng chữ “Khi tôi và con bạn thân đi đóng quảng cáo”, khiến tình huống được đặt trong bối cảnh đời thường, gần với trải nghiệm của người xem. Âm thanh chủ yếu là lời thoại trực tiếp, với giọng nói ngập ngừng và các khoảng lặng làm nổi bật sự khó xử của cảnh quay.",neutral,thảo trần,"'Thảo trần' là một từ lóng mạng chỉ tình huống hoặc cảnh quay gây cười, thường xuất phát từ những sai sót hoặc tình huống bất ngờ. Trong video, cảnh quay quảng cáo của Hương Ly và Cao Ngân với những lỗi phát âm và cử chỉ gượng gạo tạo nên một tình huống hài hước tự nhiên.",Bối cảnh studio tối giản; hai người mẫu đọc lời quảng cáo không trôi chảy; giám khảo có phản ứng ngơ ngác; text overlay liên hệ tình huống với trải nghiệm đi quay quảng cáo cùng bạn thân.
tiktok,7628919104874892562,https://www.tiktok.com/@trugduccafein/video/7628919104874892562?is_from_webapp=1,Tuyển dụng nhân sự cho Muội Boutique Retreat =))) ...,"Video là một đoạn talking head kết hợp skit tại khu vực sân trước của quán Muội Coffee. Chủ quán ngồi nói về tiêu chí tuyển dụng của quán, trong khi phía sau có một cậu bé liên tục trồng cây chuối, giữ thăng bằng và nhào lộn. Video cũng cắt sang cảnh một bạn nữ cầm nhiều huy chương vàng, được giới thiệu như một thành viên có thành tích thể thao. Phụ đề tiếng Việt chạy khớp theo lời nói, có highlight các từ khóa chính như “tiêu chí tuyển dụng”, “rất đơn giản”, “hơn 20 cái huy chương”. Góc quay chủ yếu là chính diện người nói, xen kẽ các cảnh cận huy chương và cảnh quay xoay để bắt động tác nhào lộn phía sau. Âm thanh là lời nói trực tiếp tiếng Việt với nhịp kể đều, kèm tiếng động hiện trường trong quán.",positive,shop nhiều võ sĩ rồi nên tuyển thêm pháp sư cho cân bằng ạ,"'Võ sĩ' và 'pháp sư' là hai lớp nhân vật trong các trò chơi nhập vai hoặc game trực tuyến, trong đó võ sĩ thường có sức mạnh vật lý còn pháp sư sử dụng phép thuật. Video giới thiệu các thành viên của quán có kỹ năng thể thao và nhào lộn, tương tự như hình ảnh võ sĩ.",Bối cảnh sân trước Muội Coffee; chủ quán nói về tuyển dụng; phía sau có cậu bé nhào lộn; một nhân viên cầm nhiều huy chương vàng; phụ đề tiếng Việt highlight từ khóa theo lời nói.
